{
  "schemaVersion": 1,
  "packId": "loop-001",
  "packVersion": 1,
  "title": "Mylone słowa, rozmowy online i awarie",
  "description": "Utrwalenie słów pytających i par bardzo/dużo, zwroty z wideorozmów oraz zgłoszenia awarii u operatora.",
  "createdAt": "2026-10-26T12:45:00Z",
  "basedOnExport": "2026-10-26T12:25:36.077378Z",
  "topics": [
    {
      "id": "pairs",
      "title": "Mylone słowa i pytania",
      "description": "Kontrastowe pary i pytania, które sprawiały kłopot.",
      "order": 7,
      "lessons": [
        {
          "id": "pairs.bardzo",
          "title": "Bardzo, dużo i pytania",
          "order": 0,
          "difficulty": 2,
          "grammarNote": {
            "id": "pairs.bardzo.note",
            "title": "Bardzo czy dużo?",
            "body": "**Bardzo** z przymiotnikiem:\n\n- **sangat** + przymiotnik (formalnie): *sangat penting*\n- przymiotnik + **sekali**: *enak sekali*\n- przymiotnik + **banget** (potocznie): *capek banget*\n\n**banyak** to *dużo / wielu* i stoi przed rzeczownikiem: *banyak kopi*. Z przymiotnikiem nie znaczy *bardzo*."
          },
          "items": [
            {
              "id": "pairs.sangat",
              "kind": "word",
              "id_text": "sangat",
              "pl_text": "bardzo (przed przymiotnikiem)",
              "register": "formal",
              "acceptedPl": ["bardzo"],
              "notes": "Stoi przed przymiotnikiem: sangat penting. Sekali stoi po nim: penting sekali."
            },
            {
              "id": "pairs.sibuk",
              "kind": "word",
              "id_text": "sibuk",
              "pl_text": "zajęty",
              "register": "neutral",
              "acceptedPl": ["zajęta", "zajęte", "zapracowany"]
            },
            {
              "id": "pairs.macet",
              "kind": "word",
              "id_text": "macet",
              "pl_text": "zakorkowany (korek)",
              "register": "neutral",
              "acceptedPl": ["korek", "zakorkowana", "zawieszony", "zablokowany"],
              "notes": "O urządzeniu lub systemie: zawiesił się."
            },
            {
              "id": "pairs.pulang",
              "kind": "word",
              "id_text": "pulang",
              "pl_text": "wracać do domu",
              "register": "neutral",
              "acceptedPl": ["wrócić do domu", "wracać", "wrócić", "wracać do kraju"],
              "notes": "Pulang: do domu lub kraju. Kembali: wrócić ogólnie."
            },
            {
              "id": "pairs.s-kopi-enak-sekali",
              "kind": "sentence",
              "id_text": "Kopinya enak sekali.",
              "pl_text": "Kawa jest bardzo smaczna.",
              "register": "neutral",
              "acceptedId": ["Kopinya sangat enak.", "Kopinya enak banget."],
              "acceptedPl": ["Kawa jest bardzo dobra.", "Kawa jest pyszna.", "Kawa jest bardzo pyszna.", "Ta kawa jest bardzo smaczna."],
              "distractorsId": ["banyak", "minum"],
              "distractorsPl": ["dużo", "pić"]
            },
            {
              "id": "pairs.s-banyak-kopi",
              "kind": "sentence",
              "id_text": "Saya minum banyak kopi.",
              "pl_text": "Piję dużo kawy.",
              "register": "neutral",
              "acceptedPl": ["Piję sporo kawy.", "Wypijam dużo kawy.", "Ja piję dużo kawy."],
              "distractorsId": ["sekali", "mau"],
              "distractorsPl": ["bardzo", "chcę"]
            },
            {
              "id": "pairs.s-sangat-sibuk",
              "kind": "sentence",
              "id_text": "Hari ini saya sangat sibuk.",
              "pl_text": "Dziś jestem bardzo zajęty.",
              "register": "formal",
              "acceptedId": ["Saya sangat sibuk hari ini.", "Hari ini saya sibuk sekali.", "Saya sibuk sekali hari ini."],
              "acceptedPl": ["Dzisiaj jestem bardzo zajęty.", "Dziś jestem bardzo zajęta.", "Dzisiaj jestem bardzo zajęta.", "Jestem dziś bardzo zajęty.", "Jestem dziś bardzo zajęta."],
              "distractorsId": ["banyak", "besok"],
              "distractorsPl": ["dużo", "jutro"]
            },
            {
              "id": "pairs.s-jalan-macet",
              "kind": "sentence",
              "id_text": "Jalannya macet banget.",
              "pl_text": "Na ulicy jest straszny korek.",
              "register": "colloquial",
              "acceptedId": ["Jalannya macet sekali.", "Jalannya sangat macet."],
              "acceptedPl": ["Na drodze jest straszny korek.", "Jest straszny korek.", "Ulica jest bardzo zakorkowana.", "Droga jest bardzo zakorkowana."],
              "distractorsId": ["banyak", "kantor"],
              "distractorsPl": ["dużo", "biuro"]
            },
            {
              "id": "pairs.s-di-mana-bandara",
              "kind": "sentence",
              "id_text": "Di mana bandaranya?",
              "pl_text": "Gdzie jest lotnisko?",
              "register": "neutral",
              "acceptedId": ["Bandaranya di mana?", "Di mana bandara?", "Dimana bandaranya?"],
              "acceptedPl": ["Gdzie lotnisko?"],
              "distractorsId": ["kapan", "siapa"],
              "distractorsPl": ["kiedy", "kto"]
            },
            {
              "id": "pairs.s-kapan-pulang",
              "kind": "sentence",
              "id_text": "Kapan Anda pulang ke Polandia?",
              "pl_text": "Kiedy wraca Pan do Polski?",
              "register": "formal",
              "acceptedPl": ["Kiedy wraca Pani do Polski?", "Kiedy Pan wraca do Polski?", "Kiedy Pani wraca do Polski?", "Kiedy wracasz do Polski?"],
              "distractorsId": ["di mana", "kembali"],
              "distractorsPl": ["gdzie", "jedzie"]
            },
            {
              "id": "pairs.s-siapa-nama",
              "kind": "sentence",
              "id_text": "Siapa nama Anda?",
              "pl_text": "Jak się Pan nazywa?",
              "register": "formal",
              "acceptedId": ["Nama Anda siapa?"],
              "acceptedPl": ["Jak się Pani nazywa?", "Jak Pan się nazywa?", "Jak Pani się nazywa?", "Jak się nazywasz?", "Jak masz na imię?"],
              "distractorsId": ["apa", "kapan"],
              "distractorsPl": ["kto", "gdzie"],
              "notes": "O imię pytamy siapa (kto), nie apa (co)."
            },
            {
              "id": "pairs.s-kapan-bertemu",
              "kind": "sentence",
              "id_text": "Kapan kita bisa bertemu?",
              "pl_text": "Kiedy możemy się spotkać?",
              "register": "neutral",
              "acceptedPl": ["Kiedy się możemy spotkać?", "Kiedy możemy się zobaczyć?", "Kiedy możemy się umówić?"],
              "distractorsId": ["rapat", "di mana"],
              "distractorsPl": ["spotkanie", "gdzie"],
              "notes": "Bertemu to czasownik (spotkać się), rapat to rzeczownik (spotkanie, zebranie)."
            },
            {
              "id": "pairs.s-terima-kasih-bu",
              "kind": "phrase",
              "id_text": "Terima kasih, Bu.",
              "pl_text": "Dziękuję pani.",
              "register": "formal",
              "acceptedId": ["Terima kasih, Ibu."],
              "acceptedPl": ["Dziękuję."],
              "distractorsId": ["Pak", "sama-sama"],
              "distractorsPl": ["panu", "proszę"],
              "notes": "Bu i Pak to skróty od Ibu i Bapak, używane, gdy zwracamy się do kogoś."
            }
          ]
        }
      ]
    },
    {
      "id": "call",
      "title": "Rozmowy online",
      "description": "Wideorozmowy z klientem: dźwięk, ekran, linki i pytania.",
      "order": 8,
      "lessons": [
        {
          "id": "call.online",
          "title": "Spotkanie online",
          "order": 0,
          "difficulty": 2,
          "grammarNote": {
            "id": "call.online.note",
            "title": "Bisa, boleh, harus",
            "body": "Czasowniki modalne stoją przed czasownikiem i się nie odmieniają:\n\n- **bisa** – móc, umieć: *Saya bisa mendengar Anda.*\n- **boleh** – wolno, mieć pozwolenie: *Boleh saya bertanya?*\n- **harus** – musieć: *Kita harus mulai.*\n- **perlu** – trzeba: *Perangkat perlu diperbarui.*"
          },
          "items": [
            {
              "id": "call.layar",
              "kind": "word",
              "id_text": "layar",
              "pl_text": "ekran",
              "register": "neutral",
              "acceptedId": ["screen"],
              "notes": "Też „żagiel”."
            },
            {
              "id": "call.berbagi-layar",
              "kind": "phrase",
              "id_text": "berbagi layar",
              "pl_text": "udostępnić ekran",
              "register": "neutral",
              "acceptedId": ["share layar", "share screen"],
              "acceptedPl": ["udostępniać ekran", "udostępnianie ekranu", "udostępnij ekran"]
            },
            {
              "id": "call.suara",
              "kind": "word",
              "id_text": "suara",
              "pl_text": "dźwięk (głos)",
              "register": "neutral",
              "acceptedPl": ["głos", "dźwięk"]
            },
            {
              "id": "call.jelas",
              "kind": "word",
              "id_text": "jelas",
              "pl_text": "wyraźny (jasny)",
              "register": "neutral",
              "acceptedPl": ["jasny", "wyraźnie", "jasne", "wyraźne", "zrozumiały"]
            },
            {
              "id": "call.mendengar",
              "kind": "word",
              "id_text": "mendengar",
              "pl_text": "słyszeć",
              "register": "neutral",
              "acceptedId": ["dengar", "denger"],
              "acceptedPl": ["usłyszeć", "słuchać"]
            },
            {
              "id": "call.tautan",
              "kind": "word",
              "id_text": "tautan",
              "pl_text": "link",
              "register": "formal",
              "acceptedId": ["link"],